{
  "schema": "ResidualOps_PilotFeedbackTriage/v0.1",
  "generated_at": "2026-05-30T00:53:28.334239+00:00",
  "category_count": 14,
  "categories": [
    {
      "category": "confusing_claim",
      "severity_default": "medium",
      "recommended_next_action": "rewrite claim boundary or add known-limit note",
      "route_to": "portfolio",
      "second_run_needed": false,
      "owner_consent_needed": false
    },
    {
      "category": "missing_evidence",
      "severity_default": "medium",
      "recommended_next_action": "request redacted local evidence reference",
      "route_to": "portfolio",
      "second_run_needed": true,
      "owner_consent_needed": true
    },
    {
      "category": "wrong_allow_hold_block",
      "severity_default": "high",
      "recommended_next_action": "classify feedback and schedule local second-run if consented",
      "route_to": "portfolio",
      "second_run_needed": true,
      "owner_consent_needed": true
    },
    {
      "category": "unclear_dashboard",
      "severity_default": "low",
      "recommended_next_action": "update dashboard label or operator script",
      "route_to": "portfolio",
      "second_run_needed": false,
      "owner_consent_needed": false
    },
    {
      "category": "bad_operator_script",
      "severity_default": "medium",
      "recommended_next_action": "revise manual walkthrough wording",
      "route_to": "portfolio",
      "second_run_needed": false,
      "owner_consent_needed": false
    },
    {
      "category": "missing_vertical",
      "severity_default": "medium",
      "recommended_next_action": "add vertical candidate to portfolio backlog",
      "route_to": "portfolio",
      "second_run_needed": false,
      "owner_consent_needed": false
    },
    {
      "category": "privacy_or_license_concern",
      "severity_default": "high",
      "recommended_next_action": "route to DataCapsule and keep claim ceiling explicit",
      "route_to": "datacapsule",
      "second_run_needed": true,
      "owner_consent_needed": true
    },
    {
      "category": "security_claim_concern",
      "severity_default": "high",
      "recommended_next_action": "route to AgentSec and claim-boundary review",
      "route_to": "agentsec",
      "second_run_needed": true,
      "owner_consent_needed": true
    },
    {
      "category": "data_boundary_concern",
      "severity_default": "high",
      "recommended_next_action": "route to DataCapsule use-boundary review",
      "route_to": "datacapsule",
      "second_run_needed": true,
      "owner_consent_needed": true
    },
    {
      "category": "code_release_boundary_concern",
      "severity_default": "high",
      "recommended_next_action": "route to QIRA behavior-contract review",
      "route_to": "qira",
      "second_run_needed": true,
      "owner_consent_needed": true
    },
    {
      "category": "tool_manifest_boundary_concern",
      "severity_default": "high",
      "recommended_next_action": "route to AgentSec manifest review",
      "route_to": "agentsec",
      "second_run_needed": true,
      "owner_consent_needed": true
    },
    {
      "category": "private_kernel_concern",
      "severity_default": "critical",
      "recommended_next_action": "block publication and review public/private split",
      "route_to": "portfolio",
      "second_run_needed": false,
      "owner_consent_needed": false
    },
    {
      "category": "request_real_pilot",
      "severity_default": "medium",
      "recommended_next_action": "use ROE-12 owner-consented local intake before any pilot",
      "route_to": "portfolio",
      "second_run_needed": true,
      "owner_consent_needed": true
    },
    {
      "category": "other",
      "severity_default": "unknown",
      "recommended_next_action": "manual triage",
      "route_to": "portfolio",
      "second_run_needed": false,
      "owner_consent_needed": false
    }
  ],
  "auto_issue_creation_performed": false,
  "external_api_used": false
}
